{
  "schema_version": "0.1",
  "scene_id": "scene_demo",
  "status": "draft",
  "scene_context": {
    "text": "A fictional room used only for development.",
    "audio_url": null
  },
  "world": {
    "panorama_url": "/demo/fake-panorama.jpg",
    "panorama_width": 4096,
    "panorama_height": 2048,
    "splat_url": null,
    "collider_url": null
  },
  "media": [
    {
      "id": "media_demo_001",
      "source_name": "fictional-cinema-ticket.txt",
      "type": "text",
      "url": "/demo/fictional-cinema-ticket.txt"
    }
  ],
  "memories": [
    {
      "id": "memory_demo_001",
      "name": "Fictional cinema visits",
      "summary": "Synthetic fixture data for independent module development.",
      "media_ids": ["media_demo_001"],
      "reflection": null,
      "anchor": {
        "id": "anchor_demo_001",
        "cue": { "label": "movie_poster" },
        "source_grounding": { "x": 1560, "y": 720 },
        "world_grounding": null,
        "position": null,
        "normal": null,
        "hero": {
          "status": "not_requested",
          "job_id": null,
          "asset_url": null
        }
      }
    }
  ],
  "unassigned_media_ids": []
}
